"surah","ayahs","cause"
6,"33","عَنْ عَلِيٍّ رضي الله عنه: أَنَّ أَبَا جَهْلٍ قَالَ لِلنَّبِيِّ ﷺ: إِنَّا لَا نُكَذِّبُكَ، وَلَكِنْ نُكَذِّبُ بِمَا جِئْتَ بِهِ، فَأَنْزَلَ اللهُ تَعَالَى: { فَإِنَّهُمْ لَا يُكَذِّبُونَكَ وَلَـٰكِنَّ ٱلظَّـٰلِمِينَ بِـَٔايَـٰتِ ٱللَّهِ يَجْحَدُونَ }."
6,"51-52-53-54","عَنِ ابْنِ مَسْعُودٍ رضي الله عنه قَالَ: مَرَّ الْمَلَأُ مِنْ قُرَيْشٍ عَلَى رَسُولِ اللهِ ﷺ، وَعِنْدَهُ خَبَّابٌ، وَصُهَيْبٌ، وَبِلَالٌ، وَعَمَّارٌ، فَقَالُوا: يَا مُحَمَّد أَرَضِيتَ بِهَؤُلَاءِ، فَنَزَلَ فِيهِمْ الْقُرْآنُ { وَأَنذِرْ بِهِ ٱلَّذِينَ يَخَافُونَ أَن يُحْشَرُوٓا۟ إِلَىٰ رَبِّهِمْ ۙ } إِلَى قَوْلِهِ { وَٱللَّهُ أَعْلَمُ بِٱلظَّـٰلِمِينَ }. واللفظ لأحمد.

وفي لفظ آخر: عَن ابْنِ مَسْعُودٍ رضي الله عنه قَالَ: مَرَّ الْمَلَأُ مِنْ قُرَيْشٍ بِالنَّبِيِّ وَعِنْدَهُ صُهَيْبٌ، وَعَمَّارٌ، وَبِلَالٌ، وَخَبَّابٌ، وَنَحْوهُ مِنْ ضُعفاءِ المُسلِمينَ، فَقَالُوا: يَا مُحَمَّد أَرَضِيتَ بِهَؤُلَاءِ مِنْ قَوْمِكَ، هَؤلاءِ الذَينَ مَنَّ اللَّهُ عَلَيْهِمْ مِنْ بَينِنِا، أَنَحْنُ نَكُونُ تَبعاً لِهؤُلاءِ، اطردهُمْ عَنْكَ فَلَعَلَّكَ إِنْ طَردَتَهُمْ أَنْ نَتَّبِعَكَ، فَنَزَلَتْ هَذهِ الآية: { وَلَا تَطْرُدِ ٱلَّذِينَ يَدْعُونَ رَبَّهُم بِٱلْغَدَوٰةِ وَٱلْعَشِىِّ يُرِيدُونَ وَجْهَهُۥ ۖ مَا عَلَيْكَ مِنْ حِسَابِهِم مِّن شَىْءٍ وَمَا مِنْ حِسَابِكَ عَلَيْهِم مِّن شَىْءٍ فَتَطْرُدَهُمْ فَتَكُونَ مِنَ ٱلظَّـٰلِمِينَ ﴿٥٢﴾ وَكَذَٰلِكَ فَتَنَّا بَعْضَهُم بِبَعْضٍ } إلى آخر الآية."
6,"51-52-53-54","عَنْ سَعْدٍ رضي الله عنه قَالَ: كُنَّا مَعَ النَّبِيِّ ﷺ سِتَّةَ نَفَرٍ، فَقَالَ الْمُشْرِكُونَ لِلنَّبِيِّ ﷺ: اطْرُدْ هَؤُلَاءِ لَا يَجْتَرِئُونَ عَلَيْنَا. قَالَ: وَكُنْتُ أَنَا، وَابْنُ مَسْعُودٍ، وَرَجُلٌ مِنْ هُذَيْلٍ، وَبِلَالٌ، وَرَجُلَانِ لَسْتُ أُسَمِّيهِمَا، فَوَقَعَ فِي نَفْسِ رَسُولِ اللهِ ﷺ مَا شَاءَ اللَّهُ أَنْ يَقَعَ، فَحَدَّثَ نَفْسَهُ، فَأَنْزَلَ اللهُ عز و جل: { وَلَا تَطْرُدِ ٱلَّذِينَ يَدْعُونَ رَبَّهُم بِٱلْغَدَوٰةِ وَٱلْعَشِىِّ يُرِيدُونَ وَجْهَهُۥ ۖ }."
6,"108","عَنِ ابْنِ عَبَّاسٍ رضي الله عنهما: قَوْلَهُ: { وَلَا تَسُبُّوا۟ ٱلَّذِينَ يَدْعُونَ مِن دُونِ ٱللَّهِ فَيَسُبُّوا۟ ٱللَّهَ عَدْوَۢا بِغَيْرِ عِلْمٍ ۗ }، قَالَ: قَالُوا: يَا مُحَمَّد لَتَنْتَهِيَنَّ عَنْ سَبِّ آلِهَتِنَا، أَوْ لَنَهْجُوَنَّ رَبَّكَ، فَنَهَاهُمُ اللهُ أَنْ يَسُبُّوا أَوْثَانَهُمْ، فَيَسُبُّوا اللهَ عَدُواً بِغَيْرِ عِلْمٍ."
6,"121","عن ابن عباس رضي الله عنهما قال: جادل المشركون المسلمين، فقالوا: ما بال ما قتل الله لا تأكلونه، وما قتلتم أنتم أكلتموه، وأنتم تتبعون أمر الله، فأنزل الله: { وَلَا تَأْكُلُوا۟ مِمَّا لَمْ يُذْكَرِ ٱسْمُ ٱللَّهِ عَلَيْهِ وَإِنَّهُۥ لَفِسْقٌ ۗ } إلى آخر الآية."
6,"161","عَنْ أَبِي ذَرٍّ رضي الله عنه قَالَ: قَالَ رَسُولُ اللهِ ﷺ: « مَنْ صَامَ مِنْ كُلِّ شَهْرٍ ثَلَاثَةَ أَيَّامٍ فَذَلِكَ صِيَامُ الدَّهْرِ »، فَأَنْزَلَ اللهُ عز و جل تَصْدِيقَ ذَلِكَ فِي كِتَابِهِ: { مَن جَآءَ بِٱلْحَسَنَةِ فَلَهُۥ عَشْرُ أَمْثَالِهَا ۖ }، الْيَوْمُ بِعَشْرَ أَيَّامٍ."
