"surah","ayahs","occasion"
66,"1","عن عَائِشَةَ رضي الله عنها قالت: أَنَّ النَّبِيَّ ﷺ كَانَ يَمْكُثُ عِنْدَ زَيْنَبَ بِنْتِ جَحْشٍ، وَيَشْرَبُ عِنْدَهَا عَسَلًا، فَتَوَاصَيْتُ أَنَا وَحَفْصَةُ: أَنَّ أَيَّتَنَا دَخَلَ عَلَيْهَا النَّبِيُّ ﷺ فَلْتَقُلْ: إِنِّي أَجِدُ مِنْكَ رِيحَ مَغَافِيرَ، أَكَلْتَ مَغَافِيرَ. فَدَخَلَ عَلَى إِحْدَاهُمَا فَقَالَتْ ذَلِكَ لَهُ، فَقَالَ: « لا، بَلْ شَرِبْتُ عَسَلًا عِنْدَ زَيْنَبَ بِنْتِ جَحْشٍ، وَلَنْ أَعُودَ لَهُ »، فَنَزَلَتْ: { يَـٰٓأَيُّهَا ٱلنَّبِىُّ لِمَ تُحَرِّمُ مَآ أَحَلَّ ٱللَّهُ لَكَ ۖ } { إِن تَتُوبَآ إِلَى ٱللَّهِ } لِعَائِشَةَ وَحَفْصَةَ. { وَإِذْ أَسَرَّ ٱلنَّبِىُّ إِلَىٰ بَعْضِ أَزْوَٰجِهِۦ حَدِيثًا }. لِقَوْلِهِ: « بَلْ شَرِبْتُ عَسَلًا »، وَقَالَ لِي إِبْرَاهِيمُ بْنُ مُوسَى، عَنْ هِشَامٍ: « وَلَنْ أَعُودَ لَهُ، وَقَدْ حَلَفْتُ، فَلَا تُخْبِرِي بِذَلِكِ أَحَداً ». واللفظ للبخاري."
66,"1","عن ابن عباس رضي الله عنهما قال: كان رسول الله ﷺ يشرب عند سودة العسل، فدخل على عائشة، فقالت: إني أجد منك ريحاً، ثم دخل على حفصة، فقالت: إني أجد منك ريحاً فقال: « أراه من شراب شربته عند سودة، والله لا أشربه ». فنزلت هذه الآية { يَـٰٓأَيُّهَا ٱلنَّبِىُّ لِمَ تُحَرِّمُ مَآ أَحَلَّ ٱللَّهُ لَكَ ۖ }."
66,"4-5","عَنْ أَنَسِ بْنِ مَالِكٍ قَالَ: قَالَ عُمَرُ بْنُ الْخَطَّابِ رضي الله عنه: (وَافَقْتُ رَبِّي فِي ثَلَاثٍ... ) (... وَاجْتَمَعَ نِسَاءُ النَّبِيِّ ﷺ فِي الْغَيْرَةِ عَلَيْهِ، فَقُلْتُ لَهُنَّ: { عَسَىٰ رَبُّهُۥٓ إِن طَلَّقَكُنَّ أَن يُبْدِلَهُۥٓ أَزْوَٰجًا خَيْرًا مِّنكُنَّ } فَنَزَلَتْ هَذِهِ الْآيةُ )."
66,"4-5","عَنْ عَبْدِ اللهِ بْنِ عَبَّاسٍ رضي الله عنهما: حَدَّثَنِي عُمَرُ بْنُ الْخَطَّابِ رضي الله عنه قَالَ: ( لَمَّا اعْتَزَلَ نَبِيُّ اللهِ ﷺ نِسَاءَهُ... ) (... وَدَخَلْتُ عَلَيْهِ حِينَ دَخَلْتُ، وَأَنَا أَرَى فِي وَجْهِهِ الْغَضَبَ، فَقُلْتُ: يَا رَسُولَ اللهِ، مَا يَشُقُّ عَلَيْكَ مِنْ شَأْنِ النِّسَاءِ، فَإِنْ كُنْتَ طَلَّقْتَهُنَّ، فَإِنَّ اللهَ مَعَكَ، وَمَلَائِكَتَهُ، وَجِبْرِيلَ، وَمِيكَائِيلَ وَأَنَا وَأَبُو بَكْرٍ، وَالْمُؤْمِنُونَ مَعَكَ. وَقَلَّمَا تَكَلَّمْتُ - وَأَحْمَدُ اللهَ - بِكَلَامٍ إِلَّا رَجَوْتُ أَنْ يَكُونَ اللهُ يُصَدِّقُ قَوْلِي الَّذِي أَقُولُ، وَنَزَلَتْ هَذِهِ الْآيَةُ آيَةُ التَّحْيِيرِ { عَسَىٰ رَبُّهُۥٓ إِن طَلَّقَكُنَّ أَن يُبْدِلَهُۥٓ أَزْوَٰجًا خَيْرًا مِّنكُنَّ }... { وَإِن تَظَـٰهَرَا عَلَيْهِ فَإِنَّ ٱللَّهَ هُوَ مَوْلَىٰهُ وَجِبْرِيلُ وَصَـٰلِحُ ٱلْمُؤْمِنِينَ ۖ وَٱلْمَلَـٰٓئِكَةُ بَعْدَ ذَٰلِكَ ظَهِيرٌ }.

وَكَانَتْ عَائِشَةُ بِنْتُ أَبِي بَكْرٍ، وَحَفْصَةُ، تَظَاهَرَانِ عَلَى سَائِرِ نِسَاءِ النَّبِيِّ ﷺ، فَقُلْتُ: يَا رَسُولَ اللهِ، أَطَلَّقْتَهُنَّ؟ قَالَ: « لا »، قُلْتُ: يَا رَسُولَ اللهِ إِنِّي دَخَلْتُ الْمَسْجِدَ، وَالْمُسْلِمُونَ يَنْكُتُونَ بِالْحَصَى، يَقُولُونَ: طَلَّقَ رَسُولُ اللهِ ﷺ نِسَاءَهُ، أَفَأَنْزِلُ فَأُخْبِرَهُمْ أَنَّكَ لَمْ تُطَلِّقْهُنَّ؟ قَالَ: « نَعَمْ، إِنْ شِئْتَ ». فَلَمْ أَزَلْ أُحَدِّثُهُ حَتَّى تَحَسَّرَ الْغَضَبُ عَنْ وَجْهِهِ، وَحَتَّى كَشَرَ فَضَحِكَ، وَكَانَ مِنْ أَحْسَنِ النَّاسِ ثَغْراً.

ثُمَّ نَزَلَ نَبِيُّ اللهِ ﷺ وَنَزَلْتُ، فَنَزَلْتُ أَتَشَبَّثُ بِالْجِذْعِ، وَنَزَلَ رَسُولُ اللهِ ﷺ كَأَنَّمَا يَمْشِي عَلَى الْأَرْضِ مَا يَمَسُّهُ بِيَدِهِ، فَقُلْتُ: يَا رَسُولَ اللهِ، إِنَّمَا كُنْتَ فِي الْغُرْفَةِ تِسْعَةً وَعِشْرِينَ، قَالَ: « إِنَّ الشَّهْرَ يَكُونُ تِسْعاً وَعِشْرِينَ »، فَقُمْتُ عَلَى بَابِ الْمَسْجِدِ، فَنَادَيْتُ بِأَعْلَى صَوْتِي: لَمْ يُطَلِّقْ رَسُولُ اللهِ ﷺ نِسَاءَهُ، وَنَزَلَتْ هَذِهِ الْآيَةُ: { وَإِذَا جَآءَهُمْ أَمْرٌ مِّنَ ٱلْأَمْنِ أَوِ ٱلْخَوْفِ أَذَاعُوا۟ بِهِۦ ۖ وَلَوْ رَدُّوهُ إِلَى ٱلرَّسُولِ وَإِلَىٰٓ أُو۟لِى ٱلْأَمْرِ مِنْهُمْ لَعَلِمَهُ ٱلَّذِينَ يَسْتَنۢبِطُونَهُۥ مِنْهُمْ ۗ }، فَكُنْتُ أَنَا اسْتَنْبَطْتُ ذَلِكَ الْأَمْرَ وَأَنْزَلَ اللهُ عز و جل آيَةَ التَّخْيِيرِ. واللفظ لمسلم."
